{
  "build": {
    "mode": "opt",
    "target": "//mbo/memory:arena_layout_benchmark"
  },
  "component": "ArenaLayouts",
  "content_sha256": "f8e79c042aa9c47920e4bc75e442ae8055e97f9b861f92424546dfb0d300a675",
  "controls": {
    "minimum_time": "1s",
    "random_interleaving": true,
    "repetitions": 9,
    "warmup_time": 1.0
  },
  "git": {
    "branch": "proof/arena-layouts",
    "commit": "c913ba9aea4fcc2b8f5c0cff439862c32e0a4ffd",
    "dirty": false,
    "repository": "git@github.com:mboworks/mbo"
  },
  "google_benchmark": {
    "benchmarks": [
      {
        "bytes_per_second": 164883451587.49997,
        "cpu_time": 8719.468122227214,
        "family_index": 14,
        "items_per_second": 1879013693.3048427,
        "iterations": 160488,
        "name": "Records/LookupSequential/Pointer",
        "per_family_instance_index": 0,
        "real_time": 8727.358381963088,
        "repetition_index": 0,
        "repetitions": 9,
        "reserved": 2293760.0,
        "run_name": "Records/LookupSequential/Pointer",
        "run_type": "iteration",
        "threads": 1,
        "time_unit": "ns"
      },
      {
        "bytes_per_second": 164980126307.96347,
        "cpu_time": 8714.358705946774,
        "family_index": 14,
        "items_per_second": 1880115399.5209513,
        "iterations": 160488,
        "name": "Records/LookupSequential/Pointer",
        "per_family_instance_index": 0,
        "real_time": 8722.73835452426,
        "repetition_index": 1,
        "repetitions": 9,
        "reserved": 2293760.0,
        "run_name": "Records/LookupSequential/Pointer",
        "run_type": "iteration",
        "threads": 1,
        "time_unit": "ns"
      },
      {
        "bytes_per_second": 165079394672.28253,
        "cpu_time": 8709.118438761727,
        "family_index": 14,
        "items_per_second": 1881246662.9319947,
        "iterations": 160488,
        "name": "Records/LookupSequential/Pointer",
        "per_family_instance_index": 0,
        "real_time": 8718.049013080165,
        "repetition_index": 2,
        "repetitions": 9,
        "reserved": 2293760.0,
        "run_name": "Records/LookupSequential/Pointer",
        "run_type": "iteration",
        "threads": 1,
        "time_unit": "ns"
      },
      {
        "bytes_per_second": 164892760439.39334,
        "cpu_time": 8718.975873585598,
        "family_index": 14,
        "items_per_second": 1879119777.0871036,
        "iterations": 160488,
        "name": "Records/LookupSequential/Pointer",
        "per_family_instance_index": 0,
        "real_time": 8727.72392946842,
        "repetition_index": 3,
        "repetitions": 9,
        "reserved": 2293760.0,
        "run_name": "Records/LookupSequential/Pointer",
        "run_type": "iteration",
        "threads": 1,
        "time_unit": "ns"
      },
      {
        "bytes_per_second": 165313223203.31396,
        "cpu_time": 8696.79976072948,
        "family_index": 14,
        "items_per_second": 1883911375.5363417,
        "iterations": 160488,
        "name": "Records/LookupSequential/Pointer",
        "per_family_instance_index": 0,
        "real_time": 8696.940475333531,
        "repetition_index": 4,
        "repetitions": 9,
        "reserved": 2293760.0,
        "run_name": "Records/LookupSequential/Pointer",
        "run_type": "iteration",
        "threads": 1,
        "time_unit": "ns"
      },
      {
        "bytes_per_second": 165540469938.64145,
        "cpu_time": 8684.86117342116,
        "family_index": 14,
        "items_per_second": 1886501081.92184,
        "iterations": 160488,
        "name": "Records/LookupSequential/Pointer",
        "per_family_instance_index": 0,
        "real_time": 8685.00993845847,
        "repetition_index": 5,
        "repetitions": 9,
        "reserved": 2293760.0,
        "run_name": "Records/LookupSequential/Pointer",
        "run_type": "iteration",
        "threads": 1,
        "time_unit": "ns"
      },
      {
        "bytes_per_second": 165336322611.29364,
        "cpu_time": 8695.584716614441,
        "family_index": 14,
        "items_per_second": 1884174616.652919,
        "iterations": 160488,
        "name": "Records/LookupSequential/Pointer",
        "per_family_instance_index": 0,
        "real_time": 8695.613535212517,
        "repetition_index": 6,
        "repetitions": 9,
        "reserved": 2293760.0,
        "run_name": "Records/LookupSequential/Pointer",
        "run_type": "iteration",
        "threads": 1,
        "time_unit": "ns"
      },
      {
        "bytes_per_second": 165500929705.5051,
        "cpu_time": 8686.936094910516,
        "family_index": 14,
        "items_per_second": 1886050480.974417,
        "iterations": 160488,
        "name": "Records/LookupSequential/Pointer",
        "per_family_instance_index": 0,
        "real_time": 8686.999439371973,
        "repetition_index": 7,
        "repetitions": 9,
        "reserved": 2293760.0,
        "run_name": "Records/LookupSequential/Pointer",
        "run_type": "iteration",
        "threads": 1,
        "time_unit": "ns"
      },
      {
        "bytes_per_second": 164834450157.38385,
        "cpu_time": 8722.060216340024,
        "family_index": 14,
        "items_per_second": 1878455272.4488187,
        "iterations": 160488,
        "name": "Records/LookupSequential/Pointer",
        "per_family_instance_index": 0,
        "real_time": 8729.491974474457,
        "repetition_index": 8,
        "repetitions": 9,
        "reserved": 2293760.0,
        "run_name": "Records/LookupSequential/Pointer",
        "run_type": "iteration",
        "threads": 1,
        "time_unit": "ns"
      },
      {
        "aggregate_name": "mean",
        "aggregate_unit": "time",
        "bytes_per_second": 165151236513.69748,
        "cpu_time": 8705.351455837435,
        "family_index": 14,
        "items_per_second": 1882065373.3754697,
        "iterations": 9,
        "name": "Records/LookupSequential/Pointer_mean",
        "per_family_instance_index": 0,
        "real_time": 8709.991671320762,
        "repetitions": 9,
        "reserved": 2293760.0,
        "run_name": "Records/LookupSequential/Pointer",
        "run_type": "aggregate",
        "threads": 1,
        "time_unit": "ns"
      },
      {
        "aggregate_name": "median",
        "aggregate_unit": "time",
        "bytes_per_second": 165079394672.28253,
        "cpu_time": 8709.118438761725,
        "family_index": 14,
        "items_per_second": 1881246662.9319947,
        "iterations": 9,
        "name": "Records/LookupSequential/Pointer_median",
        "per_family_instance_index": 0,
        "real_time": 8718.049013080165,
        "repetitions": 9,
        "reserved": 2293760.0,
        "run_name": "Records/LookupSequential/Pointer",
        "run_type": "aggregate",
        "threads": 1,
        "time_unit": "ns"
      },
      {
        "aggregate_name": "stddev",
        "aggregate_unit": "time",
        "bytes_per_second": 275589535.0330171,
        "cpu_time": 14.521132434016405,
        "family_index": 14,
        "items_per_second": 3140621.4818344475,
        "iterations": 9,
        "name": "Records/LookupSequential/Pointer_stddev",
        "per_family_instance_index": 0,
        "real_time": 18.552258457740507,
        "repetitions": 9,
        "reserved": 0.0,
        "run_name": "Records/LookupSequential/Pointer",
        "run_type": "aggregate",
        "threads": 1,
        "time_unit": "ns"
      },
      {
        "aggregate_name": "cv",
        "aggregate_unit": "percentage",
        "bytes_per_second": 0.001668710091735583,
        "cpu_time": 0.0016680696359799643,
        "family_index": 14,
        "items_per_second": 0.0016687100917232047,
        "iterations": 9,
        "name": "Records/LookupSequential/Pointer_cv",
        "per_family_instance_index": 0,
        "real_time": 0.0021299972672565465,
        "repetitions": 9,
        "reserved": 0.0,
        "run_name": "Records/LookupSequential/Pointer",
        "run_type": "aggregate",
        "threads": 1,
        "time_unit": "ns"
      },
      {
        "bytes_per_second": 88342830843.9402,
        "cpu_time": 16274.054003767727,
        "family_index": 20,
        "items_per_second": 1006755907.0534495,
        "iterations": 85994,
        "name": "Records/LookupPermuted/SegmentOffset",
        "per_family_instance_index": 0,
        "real_time": 16289.896190075371,
        "repetition_index": 0,
        "repetitions": 9,
        "reserved": 1704192.0,
        "run_name": "Records/LookupPermuted/SegmentOffset",
        "run_type": "iteration",
        "threads": 1,
        "time_unit": "ns"
      },
      {
        "bytes_per_second": 88480406660.01097,
        "cpu_time": 16248.74991278461,
        "family_index": 20,
        "items_per_second": 1008323722.6212076,
        "iterations": 85994,
        "name": "Records/LookupPermuted/SegmentOffset",
        "per_family_instance_index": 0,
        "real_time": 16264.340152222914,
        "repetition_index": 1,
        "repetitions": 9,
        "reserved": 1704192.0,
        "run_name": "Records/LookupPermuted/SegmentOffset",
        "run_type": "iteration",
        "threads": 1,
        "time_unit": "ns"
      },
      {
        "bytes_per_second": 88541491826.79442,
        "cpu_time": 16237.539828360159,
        "family_index": 20,
        "items_per_second": 1009019849.8779992,
        "iterations": 85994,
        "name": "Records/LookupPermuted/SegmentOffset",
        "per_family_instance_index": 0,
        "real_time": 16237.62995123135,
        "repetition_index": 2,
        "repetitions": 9,
        "reserved": 1704192.0,
        "run_name": "Records/LookupPermuted/SegmentOffset",
        "run_type": "iteration",
        "threads": 1,
        "time_unit": "ns"
      },
      {
        "bytes_per_second": 88406507590.11906,
        "cpu_time": 16262.332255738684,
        "family_index": 20,
        "items_per_second": 1007481567.9785647,